StartDate,EndDate,Status,IPAddress,Progress,Duration (in seconds),Finished,RecordedDate,ResponseId,RecipientLastName,RecipientFirstName,RecipientEmail,ExternalReference,LocationLatitude,LocationLongitude,DistributionChannel,UserLanguage,Q28,Q20,Q21,Q21_4_TEXT,Q17_1,Q18,Q19,Q2_1,Q2_2,Q2_3,Q2_4,Q2_5,Q1_1,Q26,Q3,Q7,Q6,Q5,Q11,Q8,Q13,Q16,Q23
Start Date,End Date,Response Type,IP Address,Progress,Duration (in seconds),Finished,Recorded Date,Response ID,Recipient Last Name,Recipient First Name,Recipient Email,External Data Reference,Location Latitude,Location Longitude,Distribution Channel,User Language,Write down your 6 digit survey identification code: (N/A if you do not have one),How old are you?,How do you describe yourself? - Selected Choice,How do you describe yourself? - Prefer to self-describe - Text,"What would you say you politically identify as? [-3 being strong believing Liberal, 3 being strong believing Conservative] - Rate on a Scale",Have you lived in another country other than the United States for more than 5 years?,Which Country did you live in?,Rank these options based on what you believe should be prioritized for Foreign Policy: - National Security,Rank these options based on what you believe should be prioritized for Foreign Policy: - Economic Intervention,Rank these options based on what you believe should be prioritized for Foreign Policy: - Environmental/ Global Health Interests,Rank these options based on what you believe should be prioritized for Foreign Policy: - Diplomacy,Rank these options based on what you believe should be prioritized for Foreign Policy: - Human Rights/ Democracy,"What is your perspective on the concept of humanitarian intervention, where countries intervene in another nation to prevent human rights abuses? - Rate on a Scale",Why did you rank your given choice the highest?,"A nation holds free and fair elections, but the elected government is hostile to US interests or adopts policies that are against US values, such as restricting freedoms.","Should the US intervene in countries where cultural or religious practices are considered inhumane by Western standards? For Example, not allowing women education based on religious standards?","A nation's government collapses, leading to chaos, violence, and a power vacuum that threatens regional stability. Should the US intervene to stabilize the country?",A government or militant group is carrying out systematic ethnic cleansing or genocide against a minority group within their country. Should the US intervene to stop these atrocities?,"Should the US support insurgencies or rebellions against oppressive regimes, if the *regimes* do not align with US values?","Should the US intervene in civil wars or internal political conflicts where there are no good sides? For example, if there was conflict between ISIS and Al Qaeda within a country.",Should the US intervene in countries plagued by drug trafficking and organized crime that affects regional security?,"Consider a situation where your home country/country of heritage was facing harsh pressure from an external force, would you support the US Intervening to help stop the external force? 

The chances of success and beating the external force is 60%","Should the US intervene in a foreign country experiencing a deadly virus outbreak that threatens to become a global pandemic, by providing medical aid and expertise, even if it requires significant resources?"
"{""ImportId"":""startDate"",""timeZone"":""America/Denver""}","{""ImportId"":""endDate"",""timeZone"":""America/Denver""}","{""ImportId"":""status""}","{""ImportId"":""ipAddress""}","{""ImportId"":""progress""}","{""ImportId"":""duration""}","{""ImportId"":""finished""}","{""ImportId"":""recordedDate"",""timeZone"":""America/Denver""}","{""ImportId"":""_recordId""}","{""ImportId"":""recipientLastName""}","{""ImportId"":""recipientFirstName""}","{""ImportId"":""recipientEmail""}","{""ImportId"":""externalDataReference""}","{""ImportId"":""locationLatitude""}","{""ImportId"":""locationLongitude""}","{""ImportId"":""distributionChannel""}","{""ImportId"":""userLanguage""}","{""ImportId"":""QID28_TEXT""}","{""ImportId"":""QID20""}","{""ImportId"":""QID21""}","{""ImportId"":""QID21_4_TEXT""}","{""ImportId"":""QID17_1""}","{""ImportId"":""QID18""}","{""ImportId"":""QID19_TEXT""}","{""ImportId"":""QID2_1""}","{""ImportId"":""QID2_2""}","{""ImportId"":""QID2_3""}","{""ImportId"":""QID2_4""}","{""ImportId"":""QID2_5""}","{""ImportId"":""QID1_1""}","{""ImportId"":""QID26_TEXT""}","{""ImportId"":""QID3""}","{""ImportId"":""QID7""}","{""ImportId"":""QID6""}","{""ImportId"":""QID5""}","{""ImportId"":""QID11""}","{""ImportId"":""QID8""}","{""ImportId"":""QID13""}","{""ImportId"":""QID16""}","{""ImportId"":""QID23""}"
2024-03-12 10:00:34,2024-03-12 10:02:23,IP Address,136.152.215.20,100,109,True,2024-03-12 10:02:24,R_5xS6l1MVCnhYT7j,,,,,37.8736,-122.257,anonymous,EN,,18-24 years old,Female,,-3,No,,3,5,2,4,1,1,"human rights is the foundation for people across the globe, it is universal",The US Should *NOT* Intervene,The US Should *NOT* Intervene,The US Should Intervene,The US Should Intervene,The US Should *NOT* Intervene,The US Should *NOT* Intervene,The US Should Intervene,The US Should Intervene,The US Should Intervene
2024-03-12 10:00:19,2024-03-12 10:03:27,IP Address,136.152.215.180,100,188,True,2024-03-12 10:03:27,R_3PduidZZo26yrWa,,,,,37.8736,-122.257,anonymous,EN,N/A,18-24 years old,Non-binary / third gender,,-3,No,,5,3,2,4,1,1,"Human rights is obviously the most fundamental and important aspect of foreign policy on a moral and ethical level. ",The US Should *NOT* Intervene,The US Should Intervene,The US Should *NOT* Intervene,The US Should Intervene,The US Should *NOT* Intervene,The US Should Intervene,The US Should *NOT* Intervene,The US Should Intervene,The US Should Intervene
2024-03-12 10:01:16,2024-03-12 10:04:03,IP Address,136.152.215.63,100,166,True,2024-03-12 10:04:03,R_3Nn5lgt72iG5eEA,,,,,37.8736,-122.257,anonymous,EN,N/A,18-24 years old,Male,,-2,No,,1,2,5,3,4,2,"Keeping the US safe is important to promote other important components ",The US Should *NOT* Intervene,The US Should Intervene,The US Should Intervene,The US Should Intervene,The US Should *NOT* Intervene,The US Should *NOT* Intervene,The US Should Intervene,The US Should Intervene,The US Should Intervene
2024-03-12 09:59:00,2024-03-12 10:04:12,IP Address,136.152.215.80,100,311,True,2024-03-12 10:04:12,R_10klapkhk1HHePa,,,,,37.8736,-122.257,anonymous,EN,n/a,18-24 years old,Female,,-3,No,,4,3,1,5,2,2,"I believe it is always applicable and always needed, regardless of the state of the world",The US Should *NOT* Intervene,The US Should *NOT* Intervene,The US Should Intervene,The US Should Intervene,The US Should Intervene,The US Should Intervene,The US Should Intervene,The US Should Intervene,The US Should Intervene
2024-03-12 10:01:54,2024-03-12 10:05:13,IP Address,136.152.215.249,100,198,True,2024-03-12 10:05:13,R_3Vl5cuFyxhjsjTl,,,,,37.8736,-122.257,anonymous,EN,n/q,18-24 years old,Female,,-3,No,,3,5,1,2,4,-1,"Because this area is one of the US's most lacking areas in terms of international diplomacy and cooperation and nothing else really matters if the environment is fucked ",The US Should *NOT* Intervene,The US Should *NOT* Intervene,The US Should *NOT* Intervene,The US Should Intervene,The US Should *NOT* Intervene,The US Should *NOT* Intervene,The US Should Intervene,The US Should Intervene,The US Should Intervene
2024-03-12 10:04:10,2024-03-12 10:06:57,IP Address,136.152.209.183,100,166,True,2024-03-12 10:06:57,R_8sKo3m6LIOuVX9f,,,,,37.8657,-122.2571,anonymous,EN,NA,18-24 years old,Female,,-2,No,,3,5,2,4,1,2,Human rights are essential,The US Should *NOT* Intervene,The US Should *NOT* Intervene,The US Should Intervene,The US Should Intervene,The US Should *NOT* Intervene,The US Should *NOT* Intervene,The US Should *NOT* Intervene,The US Should Intervene,The US Should Intervene
2024-03-12 10:04:25,2024-03-12 10:08:54,IP Address,136.152.215.17,100,269,True,2024-03-12 10:08:55,R_7siZmfEOTG4wr27,,,,,37.8736,-122.257,anonymous,EN,,Under 18,Female,,0,No,,2,4,3,5,1,1,"Because our democracy is in terrifying jeopardy right now, especially with the elections coming up in November",The US Should Intervene,The US Should *NOT* Intervene,The US Should *NOT* Intervene,The US Should Intervene,The US Should Intervene,The US Should *NOT* Intervene,The US Should *NOT* Intervene,The US Should *NOT* Intervene,The US Should *NOT* Intervene
2024-03-12 10:03:03,2024-03-12 10:09:18,IP Address,136.152.215.5,100,375,True,2024-03-12 10:09:18,R_12RIfRZ1xH67MM9,,,,,37.8736,-122.257,anonymous,EN,n/a,18-24 years old,Female,,-2,No,,2,4,5,3,1,2,a country can not thrive without prioritizing the concerns and rights of their citizens,The US Should *NOT* Intervene,The US Should *NOT* Intervene,The US Should *NOT* Intervene,The US Should *NOT* Intervene,The US Should *NOT* Intervene,The US Should *NOT* Intervene,The US Should *NOT* Intervene,The US Should *NOT* Intervene,The US Should *NOT* Intervene
2024-03-12 10:03:44,2024-03-12 10:09:57,IP Address,136.152.215.249,100,373,True,2024-03-12 10:09:57,R_72Jrwkiu3L2WUMw,,,,,37.8736,-122.257,anonymous,EN,N/A,18-24 years old,Female,,-2,No,,5,3,2,4,1,1,"I strongly believe that intervention should be carefully thought out and should be the last resort ",The US Should *NOT* Intervene,The US Should *NOT* Intervene,The US Should Intervene,The US Should Intervene,The US Should *NOT* Intervene,The US Should *NOT* Intervene,The US Should Intervene,The US Should *NOT* Intervene,The US Should Intervene
2024-03-12 10:06:56,2024-03-12 10:10:21,IP Address,136.152.215.3,100,205,True,2024-03-12 10:10:22,R_6dWOrQieOARR8ao,,,,,37.8736,-122.257,anonymous,EN,N/A,18-24 years old,Male,,0,Yes,Kuwait,1,3,4,2,5,1,other priorities,The US Should Intervene,The US Should *NOT* Intervene,The US Should Intervene,The US Should Intervene,The US Should *NOT* Intervene,The US Should Intervene,The US Should Intervene,The US Should Intervene,The US Should Intervene
2024-03-12 10:08:54,2024-03-12 10:11:53,IP Address,174.195.82.159,100,179,True,2024-03-12 10:11:53,R_72DkHJeoQTOx5Ie,,,,,37.7585,-122.1856,anonymous,EN,N/A,18-24 years old,Female,,-3,Yes,United States,1,4,3,5,2,2,Prioritize citizens first,The US Should *NOT* Intervene,The US Should *NOT* Intervene,The US Should Intervene,The US Should Intervene,The US Should *NOT* Intervene,The US Should *NOT* Intervene,The US Should *NOT* Intervene,The US Should *NOT* Intervene,The US Should Intervene
2024-03-12 10:07:20,2024-03-12 10:12:03,IP Address,136.152.215.170,100,282,True,2024-03-12 10:12:03,R_2f82zHwJ5S9KWHI,,,,,37.8736,-122.257,anonymous,EN,,18-24 years old,Female,,-2,No,,2,4,1,5,3,2,"I think that environmental issues and the overall interests of all countries matter the most, especially because of global warming and the fact that we are all at risk regardless if we do not do something about the environment.",The US Should *NOT* Intervene,The US Should *NOT* Intervene,The US Should Intervene,The US Should Intervene,The US Should *NOT* Intervene,The US Should *NOT* Intervene,The US Should Intervene,The US Should Intervene,The US Should Intervene
2024-03-12 10:06:22,2024-03-12 10:12:34,IP Address,136.152.215.53,100,371,True,2024-03-12 10:12:34,R_7OJqIRHO7nJrzOT,,,,,37.8736,-122.257,anonymous,EN,vsgvf8,18-24 years old,Female,,-2,No,,1,4,3,5,2,1,"national security is always important, and can be useful to maintain the population safe from threats as long as the humanity of people is not being degraded. ",The US Should *NOT* Intervene,The US Should *NOT* Intervene,The US Should *NOT* Intervene,The US Should Intervene,The US Should Intervene,The US Should *NOT* Intervene,The US Should Intervene,The US Should *NOT* Intervene,The US Should Intervene
2024-03-12 10:06:51,2024-03-12 10:12:49,IP Address,136.152.215.20,100,357,True,2024-03-12 10:12:49,R_5CIfAHZ02fn6jBO,,,,,37.8736,-122.257,anonymous,EN,303899,18-24 years old,Male,,-3,No,,4,3,1,5,2,1,"Human rights is the bare minimum of humanity. However I did not strongly support because the idea of intervention is always in a form of domination. So I believe in protecting human rights where I hold worry is how Nation-States go about defending those rights  ",The US Should *NOT* Intervene,The US Should Intervene,The US Should Intervene,The US Should Intervene,The US Should *NOT* Intervene,The US Should *NOT* Intervene,The US Should *NOT* Intervene,The US Should Intervene,The US Should Intervene
2024-03-12 10:08:26,2024-03-12 10:13:47,IP Address,136.152.215.35,100,321,True,2024-03-12 10:13:48,R_7kAnOzNuRjPviDU,,,,,37.8736,-122.257,anonymous,EN,l8fkdk,18-24 years old,Female,,-2,Yes,Malawi,4,1,5,3,2,2,"from Obersvation of when countries become concerned in intervention when there is crisis or conflict in that country. ",The US Should *NOT* Intervene,The US Should *NOT* Intervene,The US Should *NOT* Intervene,The US Should Intervene,The US Should *NOT* Intervene,The US Should Intervene,The US Should *NOT* Intervene,The US Should *NOT* Intervene,The US Should Intervene
2024-03-12 10:10:51,2024-03-12 10:14:11,IP Address,136.152.215.34,100,199,True,2024-03-12 10:14:11,R_3YRG4R5DO1qsmv7,,,,,37.8736,-122.257,anonymous,EN,N/A,18-24 years old,Female,,-3,No,,2,5,1,4,3,2,"In my opinion, without the Earth, we have nothing. We need to take care of our planet first.",The US Should Intervene,The US Should *NOT* Intervene,The US Should Intervene,The US Should Intervene,The US Should Intervene,The US Should *NOT* Intervene,The US Should Intervene,The US Should Intervene,The US Should Intervene
2024-03-12 10:10:43,2024-03-12 10:15:02,IP Address,136.152.215.77,100,259,True,2024-03-12 10:15:03,R_2TRcFeaMPMrzodb,,,,,37.8736,-122.257,anonymous,EN,fzue8d,18-24 years old,Female,,-3,No,,2,4,3,5,1,2,"I think that human rights should be prioritized above all else. ",The US Should *NOT* Intervene,The US Should *NOT* Intervene,The US Should Intervene,The US Should Intervene,The US Should Intervene,The US Should *NOT* Intervene,The US Should Intervene,The US Should Intervene,The US Should Intervene
2024-03-12 11:08:05,2024-03-12 11:12:51,IP Address,136.24.201.207,100,285,True,2024-03-12 11:12:52,R_5DSVEMGPAcFtuXs,,,,,37.8657,-122.2571,anonymous,EN,N/A,18-24 years old,Male,,2,Yes,"Brazil ",2,5,4,3,1,1,"Without democracy we have nothing ",The US Should *NOT* Intervene,The US Should *NOT* Intervene,The US Should Intervene,The US Should Intervene,The US Should Intervene,The US Should *NOT* Intervene,The US Should Intervene,The US Should Intervene,The US Should Intervene
2024-03-12 11:33:31,2024-03-12 11:42:28,IP Address,104.28.111.145,100,536,True,2024-03-12 11:42:28,R_5PTrk7TPVTzbeM6,,,,,34.1027,-118.2231,anonymous,EN,N/A,45-54 years old,Female,,-1,Yes,Iran,2,3,4,5,1,2,"When a nation is unable to solve its own problems, the UN should intervene. However, I am strongly against intervening to make another war.",The US Should *NOT* Intervene,The US Should *NOT* Intervene,The US Should Intervene,The US Should *NOT* Intervene,The US Should *NOT* Intervene,The US Should *NOT* Intervene,The US Should Intervene,The US Should Intervene,The US Should Intervene
2024-03-12 11:50:12,2024-03-12 11:56:55,IP Address,80.187.122.231,100,403,True,2024-03-12 11:56:56,R_2CdZrCH9XG6wDkl,,,,,50.7617,7.0512,anonymous,EN,,45-54 years old,Male,,-1,Yes,Iran,1,2,4,5,3,1,People rights and lives matter,The US Should *NOT* Intervene,The US Should *NOT* Intervene,The US Should *NOT* Intervene,The US Should Intervene,The US Should *NOT* Intervene,The US Should *NOT* Intervene,The US Should *NOT* Intervene,The US Should Intervene,The US Should Intervene
2024-03-12 13:03:16,2024-03-12 13:07:29,IP Address,136.152.215.132,100,252,True,2024-03-12 13:07:30,R_3GEyFvfjo3tHrah,,,,,37.8736,-122.257,anonymous,EN,n/a,18-24 years old,Female,,-3,No,,5,3,2,4,1,2,I strongly support the protection of human rights even in countries that are not the U.S.,The US Should *NOT* Intervene,The US Should Intervene,The US Should *NOT* Intervene,The US Should Intervene,The US Should *NOT* Intervene,The US Should *NOT* Intervene,The US Should Intervene,The US Should Intervene,The US Should Intervene
2024-03-12 13:48:19,2024-03-12 13:51:27,IP Address,136.152.215.67,100,187,True,2024-03-12 13:51:27,R_18uVJHDht0It4Vb,,,,,37.8736,-122.257,anonymous,EN,n/a,18-24 years old,Female,,-3,No,,2,4,3,5,1,1,"i think that human rights should be the top priority for all nations. ",The US Should *NOT* Intervene,The US Should *NOT* Intervene,The US Should Intervene,The US Should Intervene,The US Should Intervene,The US Should *NOT* Intervene,The US Should Intervene,The US Should Intervene,The US Should Intervene
2024-03-12 13:52:09,2024-03-12 13:55:17,IP Address,136.152.215.47,100,188,True,2024-03-12 13:55:17,R_3kAlIa8hv2aMZwl,,,,,37.8736,-122.257,anonymous,EN,9deu1y,18-24 years old,Female,,-2,No,,1,2,4,5,3,1,"I think national security is an extremely important factor in foreign policy, because without national security, each nation might engage in more war than is ",The US Should Intervene,The US Should *NOT* Intervene,The US Should Intervene,The US Should Intervene,The US Should *NOT* Intervene,The US Should *NOT* Intervene,The US Should *NOT* Intervene,The US Should *NOT* Intervene,The US Should Intervene
2024-03-12 13:53:00,2024-03-12 13:56:00,IP Address,136.152.215.107,100,179,True,2024-03-12 13:56:00,R_2L0FgJOuo4oDwd7,,,,,37.8736,-122.257,anonymous,EN,f6aaww,18-24 years old,Female,,-2,Yes,United Arab Emirates,3,2,5,4,1,2,"I believe human rights and democracy should be at the forefront of every state's thinking. ",The US Should Intervene,The US Should Intervene,The US Should Intervene,The US Should Intervene,The US Should *NOT* Intervene,The US Should Intervene,The US Should Intervene,The US Should Intervene,The US Should Intervene
2024-03-12 13:54:01,2024-03-12 13:57:24,IP Address,136.152.215.79,100,202,True,2024-03-12 13:57:24,R_2INAy9DXuGiCgaB,,,,,37.8736,-122.257,anonymous,EN,19ivue,18-24 years old,Male,,-2,No,,4,5,1,3,2,1,"Environmental issues effect everyone ",The US Should *NOT* Intervene,The US Should *NOT* Intervene,The US Should *NOT* Intervene,The US Should Intervene,The US Should *NOT* Intervene,The US Should *NOT* Intervene,The US Should *NOT* Intervene,The US Should Intervene,The US Should Intervene
2024-03-12 13:53:58,2024-03-12 13:58:57,IP Address,136.152.209.196,100,299,True,2024-03-12 13:58:58,R_2L6kgM2UmVIZKCU,,,,,37.8657,-122.2571,anonymous,EN,e5zx6o,18-24 years old,Female,,-2,Yes,Indonesia,4,3,2,5,1,1,"Because human rights abuses are necessary to intervene but have a high possibility to backfire if not educated or understand the cultural values, norms, or even the nature of the atrocity itself.",The US Should *NOT* Intervene,The US Should *NOT* Intervene,The US Should *NOT* Intervene,The US Should Intervene,The US Should Intervene,The US Should *NOT* Intervene,The US Should *NOT* Intervene,The US Should Intervene,The US Should Intervene
2024-03-12 13:55:42,2024-03-12 13:59:11,IP Address,136.152.215.166,100,208,True,2024-03-12 13:59:11,R_2prZ7WVTY0xYCKl,,,,,37.8736,-122.257,anonymous,EN,8bekd9,18-24 years old,Female,,-1,No,,4,3,2,5,1,1,"I believe basic human rights should be prioritized above all else. ",The US Should Intervene,The US Should *NOT* Intervene,The US Should *NOT* Intervene,The US Should Intervene,The US Should *NOT* Intervene,The US Should *NOT* Intervene,The US Should Intervene,The US Should Intervene,The US Should Intervene
2024-03-12 13:56:45,2024-03-12 14:01:14,IP Address,136.152.209.150,100,269,True,2024-03-12 14:01:15,R_2YaGp7kehWQ5CEx,,,,,37.8657,-122.2571,anonymous,EN,,18-24 years old,Female,,-1,No,,4,3,1,2,5,-1,"The US should mind their business and quit involving themselves in other countries just to leave them worse off. ",The US Should *NOT* Intervene,The US Should *NOT* Intervene,The US Should *NOT* Intervene,The US Should Intervene,The US Should *NOT* Intervene,The US Should *NOT* Intervene,The US Should *NOT* Intervene,The US Should *NOT* Intervene,The US Should Intervene
2024-03-12 13:58:50,2024-03-12 14:01:28,IP Address,136.152.215.221,100,158,True,2024-03-12 14:01:28,R_5HBbop0A0qJi8gz,,,,,37.8736,-122.257,anonymous,EN,N/A,18-24 years old,Female,,0,No,,2,4,3,5,1,2,N/A,The US Should Intervene,The US Should Intervene,The US Should Intervene,The US Should *NOT* Intervene,The US Should *NOT* Intervene,The US Should *NOT* Intervene,The US Should Intervene,The US Should Intervene,The US Should Intervene
2024-03-12 13:58:46,2024-03-12 14:03:35,IP Address,136.152.215.130,100,288,True,2024-03-12 14:03:35,R_3RPlblFvPLgQQem,,,,,37.8736,-122.257,anonymous,EN,ge5hm9,18-24 years old,Female,,-3,No,,3,2,4,5,1,2,"While human rights and democracy are different topics, I think it is crucial to uphold the rights of individuals when discussing foreign policy to ensure that policy is not focused just on the desires of one country.",The US Should *NOT* Intervene,The US Should Intervene,The US Should Intervene,The US Should Intervene,The US Should Intervene,The US Should *NOT* Intervene,The US Should Intervene,The US Should Intervene,The US Should Intervene
2024-03-12 14:00:52,2024-03-12 14:03:50,IP Address,136.152.215.35,100,178,True,2024-03-12 14:03:51,R_34ZhGNS4Owm9TW1,,,,,37.8736,-122.257,anonymous,EN,rr2jqe,18-24 years old,Female,,-2,No,,2,4,3,5,1,1,I think people have a responsibility to help other people.,The US Should *NOT* Intervene,The US Should *NOT* Intervene,The US Should *NOT* Intervene,The US Should Intervene,The US Should *NOT* Intervene,The US Should *NOT* Intervene,The US Should *NOT* Intervene,The US Should Intervene,The US Should Intervene
2024-03-12 13:49:59,2024-03-12 14:06:10,IP Address,174.195.134.170,100,971,True,2024-03-12 14:06:11,R_2PddercEeTyEkLy,,,,,33.8789,-117.5353,anonymous,EN,N/A,18-24 years old,Female,,0,No,,4,5,3,1,2,0,Its important to have a peaceful and effective method when dealing with global issues,The US Should Intervene,The US Should *NOT* Intervene,The US Should Intervene,The US Should Intervene,The US Should *NOT* Intervene,The US Should *NOT* Intervene,The US Should Intervene,The US Should Intervene,The US Should Intervene
2024-03-12 14:02:54,2024-03-12 14:06:57,IP Address,136.152.215.167,100,242,True,2024-03-12 14:06:57,R_2syweu9wAP6S114,,,,,37.8736,-122.257,anonymous,EN,aaafof,18-24 years old,Female,,-2,No,,3,4,2,5,1,1,"The way in which ""human right abuse"" is defined by the U.S is not always done with the right intentions.",The US Should *NOT* Intervene,The US Should *NOT* Intervene,The US Should Intervene,The US Should Intervene,The US Should *NOT* Intervene,The US Should *NOT* Intervene,The US Should *NOT* Intervene,The US Should Intervene,The US Should Intervene
2024-03-12 14:03:26,2024-03-12 14:07:09,IP Address,136.152.209.203,100,223,True,2024-03-12 14:07:10,R_7fiwyuZDJjJdjS3,,,,,37.8657,-122.2571,anonymous,EN,k2unca,18-24 years old,Male,,-2,No,,2,5,3,4,1,1,It is the most important to me,The US Should *NOT* Intervene,The US Should *NOT* Intervene,The US Should Intervene,The US Should Intervene,The US Should *NOT* Intervene,The US Should *NOT* Intervene,The US Should Intervene,The US Should *NOT* Intervene,The US Should Intervene
2024-03-12 14:02:39,2024-03-12 14:07:33,IP Address,136.152.215.248,100,294,True,2024-03-12 14:07:34,R_7eE4Z50d8iRmJqG,,,,,37.8736,-122.257,anonymous,EN,9zc9ot,18-24 years old,Male,,-3,No,,5,3,2,4,1,-2,The US has an abundance of unresolved human rights issues and has not reconciled its history with slavery and colonialism.,The US Should *NOT* Intervene,The US Should *NOT* Intervene,The US Should *NOT* Intervene,The US Should Intervene,The US Should *NOT* Intervene,The US Should *NOT* Intervene,The US Should *NOT* Intervene,The US Should Intervene,The US Should Intervene
2024-03-12 14:04:38,2024-03-12 14:07:36,IP Address,136.152.215.71,100,178,True,2024-03-12 14:07:36,R_7e8ndYlNIA5Yfp6,,,,,37.8736,-122.257,anonymous,EN,7ym7i0,18-24 years old,Male,,-3,No,,5,1,2,4,3,-1,I believe the government intervention is currently our best bet for counteracting the exploitative nature of capitalism,The US Should *NOT* Intervene,The US Should *NOT* Intervene,The US Should *NOT* Intervene,The US Should *NOT* Intervene,The US Should *NOT* Intervene,The US Should *NOT* Intervene,The US Should *NOT* Intervene,The US Should *NOT* Intervene,The US Should *NOT* Intervene
2024-03-12 14:06:06,2024-03-12 14:10:35,IP Address,107.115.33.45,100,268,True,2024-03-12 14:10:35,R_2qxwmW2FzhSg1QQ,,,,,36.7405,-119.7508,anonymous,EN,t2ic40,18-24 years old,Female,,-2,No,,2,3,4,5,1,1,"it was important ",The US Should *NOT* Intervene,The US Should *NOT* Intervene,The US Should Intervene,The US Should Intervene,The US Should *NOT* Intervene,The US Should Intervene,The US Should *NOT* Intervene,The US Should Intervene,The US Should Intervene
2024-03-12 15:04:50,2024-03-12 15:07:45,IP Address,136.24.201.207,100,174,True,2024-03-12 15:07:45,R_2xblhMgOiabbLln,,,,,37.8657,-122.2571,anonymous,EN,N/A,18-24 years old,Male,,1,Yes,CHINA INDONESIA UAE CANADA,1,5,4,2,3,-1,"I value safety of myself, people around me and my property",The US Should *NOT* Intervene,The US Should *NOT* Intervene,The US Should *NOT* Intervene,The US Should *NOT* Intervene,The US Should *NOT* Intervene,The US Should *NOT* Intervene,The US Should *NOT* Intervene,The US Should *NOT* Intervene,The US Should *NOT* Intervene
